{
  "schema_version": 1,
  "id": "feedback-analysis-system",
  "display_name": "Feedback Analysis System",
  "summary": "Local-first feedback intelligence application with imports, AI classification, review, analytics, and audit-preserving exports.",
  "kind": "reference-application",
  "maturity": "beta",
  "source": {
    "url": "https://github.com/ryanshi1103/feedback-analysis-system",
    "license": "Learning and internal use"
  },
  "integration": {
    "mode": "bundled",
    "bundled_path": "applications/feedback-analysis-system"
  },
  "capabilities": [
    "structured feedback import",
    "AI-assisted classification",
    "human review dashboard",
    "auditable local export"
  ],
  "design_patterns": [
    "retain original AI output",
    "append human review audit",
    "content-addressed deduplication",
    "mock mode without credentials"
  ],
  "lifecycle": {
    "stages": ["import", "validate and deduplicate", "analyze", "human review", "export"],
    "approvals": ["human correction before operational use"]
  },
  "safety": {
    "local_first": true,
    "preserves_originals": true,
    "review_before_side_effects": true,
    "secrets": "environment",
    "network": "Optional DeepSeek and Apify connections are explicit; mock mode and SQLite remain local."
  }
}
